{
  "id": 295,
  "name": "johto-safari-blocks-peak-min-35",
  "condition": {
    "name": "johto-safari-blocks",
    "url": "/api/v2/encounter-condition/26/"
  },
  "names": [
    {
      "name": "At least 35 Peak block points placed",
      "language": {
        "name": "en",
        "url": "/api/v2/language/9/"
      }
    }
  ]
}