{
  "id": 31,
  "name": "story-progress-oak-eterna-city",
  "condition": {
    "name": "story-progress",
    "url": "/api/v2/encounter-condition/9/"
  },
  "names": [
    {
      "name": "Talked to Professor Oak at Eterna City",
      "language": {
        "name": "en",
        "url": "/api/v2/language/9/"
      }
    },
    {
      "name": "Après avoir parlé au Prof. Chen à Vestigion",
      "language": {
        "name": "fr",
        "url": "/api/v2/language/5/"
      }
    }
  ]
}